"14547","Sia Martinez and the Moonlit Beginning of Everything","9781534448636","2020","Gilliland","Fiction","Contemporary, Science Fiction","No","No","Simon & Schuster / Simon Pulse","","No","","Black/African, Christian, Latinx","","Mexican American (primary and secondary); Haitian American (secondary)","","Primary character's family is Catholic.","Christian, Female, Human, Latinx, Other Heritage Specification, Text","","Mexican American","","","raised Catholic","Kirkus","","","","","","","","","","","","","","","","","","","","","","","","","","","","","","","","","","Black/African, Christian, Female, Human, Latinx, Male, Other Heritage Specification, Text","","Sia's mother, father, and grandmother are Mexican or Mexican American. Her best friend is Haitian American. Her love interest is white.","","","Primary character's family is Catholic.","Kirkus","","","","","","","","","","","","","","","","","","","","","","","","","","","","","","","","","","Raquel Vasquez Gilliland","Author","Female, Latinx (Raquel Vasquez Gilliland)","","","Mexican American","",""
"14614","Jack and Santa","9780593113981","2020","Barnett","Picture Book","Animal Fantasy","No","No","Penguin Random House / Viking","","No","","Christian","","","","This is a Christmas book.","Animal, Assumed White, Human, Illustrations, Male, Text","","","","Rabbit; Santa Claus","","","","","","","","","","","","","","","","","","","","","","","","","","","","","","","","","","","","None","","","","","","","","","","","","","","","","","","","","","","","","","","","","","","","","","","","","","","","","Mac Barnett, Greg Pizzoli","Author, Illustrator","Male, White (Mac Barnett), Male, White (Greg Pizzoli)","","","","",""
"14616","Always Together at Christmas","9780593380840","2020","Sargent","Picture Book","Contemporary","No","No","Random House","","No","","Christian, Multicultural General","","Multicultural (primary)","","Christmas book","Christian, Female, Group, Human, Illustrations, Illustrations, Male","","Diverse","","Several diverse families","They are all celebrating Christmas.","","","","","","","","","","","","","","","","","","","","","","","","","","","","","","","","","","","None","","","","","","","","","","","","","","","","","","","","","","","","","","","","","","","","","","","","","","","","Mark Chambers, Sara Sargent","Author, Illustrator","Male, White (Mark Chambers), Female, White (Sara Sargent)","","","","",""
"14629","Peppermint Post","9780062847171","2020","Hale","Picture Book","Animal Fantasy","No","No","Harper / HarperCollins","","No","","Christian","","","","Christmas book","Animal, Male, Text","","","","Polar bear","","","","","","","","","","","","","","","","","","","","","","","","","","","","","","","","","","","","Animal, Female, Male, Text","","","","Penguins","","","","","","","","","","","","","","","","","","","","","","","","","","","","","","","","","","","","Stephanie Laberis, Bruce Hale","Author, Illustrator","Female, White (Stephanie Laberis), Male, White (Bruce Hale)","","","","",""
"14654","Mind the Gap, Dash & Lily","9780593301548","2020","Cohn","Fiction","Contemporary, Series Fiction","No","No","Knopf / Random House","","No","","Christian","","","","Characters celebrate Christmas","Assumed White, Female, Human, Male, Other Heritage Specification, Text","","","","2","","Kirkus review of another book in series","","","","","","","","","","","","","","","","","","","","","","","","","","","","","","","","","","None","","","","","","","","","","","","","","","","","","","","","","","","","","","","","","","","","","","","","","","","Rachel Cohn, David Levithan","Author","Female, White (Rachel Cohn), LGBTQ, Male, White (David Levithan)","","Gay","","",""
"14695","Redemption Prep","9780062662033","2020","Miller","Fiction","Fantasy","No","No","HarperCollins / Katherine Tegen Books","","No","","Asian, Christian, Cognitive/Neurological","Neurodivergent, possibly autism (1 of 3 primary)","Indian American (1 of 3 primary)","","Set at a school rooted in Christian ideology, where Mass is compulsory. Most characters are NOT Christian.","Asian, Assumed White, Cognitive/Neurological, Female, Group, Human, Male, Other Heritage Specification, Text","Evan is coded neurodivergent, possibly on autism spectrum","Neesha is Indian American. Evan and Aiden are white.","","3","","Kirkus","","","","","","","","","","","","","","","","","","","","","","","","","","","","","","","","","","Assumed White, Female, Human, Other Heritage Specification, Text","","","","","","Kirkus","","","","","","","","","","","","","","","","","","","","","","","","","","","","","","","","","","Samuel Miller","Author","Male, White (Samuel Miller)","","","","",""
"14713","Oh Brother!","9781433832437","2020","Pellai","Picture Book","Contemporary","No","No","Magination","","Yes","Translated from the Italian. Originally published in Italy.","Christian","","","","This family celebrates Christmas.","Assumed White, Christian, Human, Illustrations, Male, Text","","","","","He celebrates Christmas.","","","","","","","","","","","","","","","","","","","","","","","","","","","","","","","","","","","Assumed White, Christian, Female, Human, Illustrations, Illustrations, Male, Text","","","","","They celebrate Christmas.","","","","","","","","","","","","","","","","","","","","","","","","","","","","","","","","","","","Elisa Paganelli, Alberto Pellai, Barbara Tamborini, Katie ten Hagen","Author, Illustrator, Translator","Female, White (Elisa Paganelli), Male, White (Alberto Pellai), Female, White (Barbara Tamborini), Heritage Unknown, Unknown (Katie ten Hagen)","","","","",""
"14729","Joey: The Story of Joe Biden","9781534480537","2020","920 Biden","Non-Fiction","Biography/History","No","No","Paula Wiseman Books / Simon & Schuster","","No","","Christian, Cognitive/Neurological","Stutter (primary)","","","Catholic (primary)","Christian, Cognitive/Neurological, Confirmed White, Human, Male, Text, Text","Stutter","","","","Catholic","","","","","","","","","","","","","","","","","","","","","","","","","","","","","","","","","","","None","","","","","","","","","","","","","","","","","","","","","","","","","","","","","","","","","","","","","","","","Amy June Bates, Jill Biden","Author, Illustrator","Female, White (Amy June Bates), Female, White (Jill Biden)","","","","",""
"14737","I Want a Hippopotamus for Christmas","9780063043213","2020","782 Rox","Non-Fiction","Contemporary","No","No","Harper / HarperCollins","","No","","Christian","","","","Christmas book, based on Christmas song","Assumed White, Christian, Female, Human, Illustrations, Illustrations","","","","","She celebrates Christmas.","","","","","","","","","","","","","","","","","","","","","","","","","","","","","","","","","","","Animal","","","","Hippopotamus","","","","","","","","","","","","","","","","","","","","","","","","","","","","","","","","","","","","Bruce Whatley, John Rox","Author, Illustrator","Male, White (Bruce Whatley), Male, White (John Rox)","","","","",""
"14744","Tiara's Hat Parade","9780807579459","2020","Lyons","Picture Book","Contemporary","No","No","Albert Whitman","","No","","Black/African, Christian","","African American (primary and secondary)","","The family says grace before dinner.","Black/African, Christian, Female, Human, Illustrations, Text, Text","","African American","","","","","","","","","","","","","","","","","","","","","","","","","","","","","","","","","","","","","","Black/African, Christian, Female, Human, Illustrations, Text, Text","","African American","","","","","","","","","","","","","","","","","","","","","","","","","","","","","","","","","","","","","","Nicole Tadgell, Kelly Starling Lyons","Author, Illustrator","Black/African, Female (Nicole Tadgell), Black/African, Female (Kelly Starling Lyons)","","","African American","",""
"14866","The Strange Birds of Flannery O'Connor: A Life","9781592702954","2020","920 O'Connor","Non-Fiction","Biography/History","No","No","Enchanted Lion","","No","","Christian, Physical","As a child, she was pigeon-toed and wore corrective shoes. Diagnosed with Lupus at age 25. Used crutches. (primary)","","","Catholic (primary)","Christian, Confirmed White, Female, Human, Physical, Text, Text","As a child, she was pigeon-toed and wore corrective shoes. Diagnosed with Lupus at age 25. Used crutches.","","","","Catholic","","","","","","","","","","","","","","","","","","","","","","","","","","","","","","","","","","","None","","","","","","","","","","","","","","","","","","","","","","","","","","","","","","","","","","","","","","","","Amy Alznauer, Ping Zhu","Author, Illustrator","Female, White (Amy Alznauer), Asian, Female (Ping Zhu)","","","Chinese American","",""
"14876","The Bridge","9781338325034","2020","Konigsberg","Fiction","Contemporary","No","No","Scholastic Press","","No","","Asian, Christian, Jewish, LGBTQ Character/Topic, Psychiatric","Depression and suicidal ideation (2 primary)","Korean American (1 of 2 primary)","Gay cis male (1 of 2 primary)","1 primary has a Christian mom and Jewish dad","Asian, Christian, Confirmed White, Female, Human, Jewish, LGBTQ+, Male, Other Heritage Specification, Psychiatric, Text","Depression and suicidal ideation (both characters)","Aaron is white. Tillie is Korean American.","Aaron is a cis gay male.","2","Aaron has a Christian mom and Jewish dad.","Kirkus","","","","","","","","","","","","","","","","","","","","","","","","","","","","","","","","","","None","","","","","","","","","","","","","","","","","","","","","","","","","","","","","","","","","","","","","","","","Bill Konigsberg","Author","LGBTQ, Male, White (Bill Konigsberg)","","Gay","","",""
"14950","Never Grow Up","9781534412217","2021","Kingsbury","Fiction","Contemporary, Series Fiction","No","No","Paula Wiseman Books / Simon & Schuster","","No","","Christian","","","","Christian (primary)","Assumed White, Christian, Female, Human, Text, Text","","","","","","","","","","","","","","","","","","","","","","","","","","","","","","","","","","","","","","","","Assumed White, Christian, Female, Human, Male, Text, Text","","","","","","","","","","","","","","","","","","","","","","","","","","","","","","","","","","","","","","","","Karen Kingsbury, Tyler Russell","Author","Female, White (Karen Kingsbury), Male, White (Tyler Russell)","","","","",""
"14960","A Place to Hang the Moon","9780823447053","2021","Albus","Fiction","Historical","No","No","Holiday House","","No","","Christian","","","","Primary characters celebrate Christmas","Assumed White, Christian, Female, Human, Male, Text, Text","","","","3","They celebrate Christmas.","Kirkus","","","","","","","","","","","","","","","","","","","","","","","","","","","","","","","","","","Assumed White, Female, Human, Male, Text, Text","","","","","","Kirkus","","","","","","","","","","","","","","","","","","","","","","","","","","","","","","","","","","Kate Albus","Author","Female, White (Kate Albus)","","","","",""
"14999","Aretha Franklin (Little People, Big Dreams)","9780711246867","2020","SNF","Non-Fiction","Biography/History, Series Non-fiction","No","No","Frances Lincoln Children's Books / Quarto","","No","","Black/African, Christian","","African American (primary)","","Christian (primary)","Black/African, Christian, Female, Human, Text, Text","","African American","","","","","","","","","","","","","","","","","","","","","","","","","","","","","","","","","","","","","","None","","","","","","","","","","","","","","","","","","","","","","","","","","","","","","","","","","","","","","","","Ma Isabel Sanchez Vegara, Amy Blackwell","Author, Illustrator","Female, White (Ma Isabel Sanchez Vegara), Female, White (Amy Blackwell)","","","Also known as Maria Isabel Sanchez Vegara and Isabel Sanchez Vegara","",""
"15116","What Is the Civil Rights Movement? (Who HQ)","9781524792305","2020","SNF","Non-Fiction","Biography/History, Series Non-fiction","No","No","Penguin Random House / Penguin Workshop","","No","","Black/African, Christian","","About the Civil Rights Movement","","Christian (primary)","Black/African, Christian, Female, Human, Male, Text, Text","","African American","","","MLK Jr. was Christian.","","","","","","","","","","","","","","","","","","","","","","","","","","","","","","","","","","","None","","","","","","","","","","","","","","","","","","","","","","","","","","","","","","","","","","","","","","","","Tim Foley, Sherri L Smith","Author, Illustrator","Male, White (Tim Foley), Female (Sherri L Smith)","","","","",""
"15118","Who Was Martin Luther King, Jr.?","9780593222737","2020","SNF","Non-Fiction","Biography/History, Board Book, Series Non-fiction","No","No","Penguin Random House / Rise x Penguin Workshop","","No","","Black/African, Christian","","African American (primary)","","Christian (primary)","Black/African, Christian, Human, Male, Text, Text","","African American","","","","","","","","","","","","","","","","","","","","","","","","","","","","","","","","","","","","","","None","","","","","","","","","","","","","","","","","","","","","","","","","","","","","","","","","","","","","","","","Lisbeth Kaiser, Stanley Chow","Author, Illustrator","Female, White (Lisbeth Kaiser), Asian, Male (Stanley Chow)","","","","",""
"15144","I Want to Ride the Tap Tap","9780374312145","2021","Joseph","Picture Book","Contemporary","No","No","Farrar Straus Giroux","","No","","Black/African, Christian, Latinx","","Haitian (all characters); set in Haiti","","Christian (primary)","Black/African, Christian, Human, Latinx, Male, Text, Text","","Haitian","","","","","","","","","","","","","","","","","","","","","","","","","","","","","","","","","","","","","","None","","","","","","","","","","","","","","","","","","","","","","","","","","","","","","","","","","","","","","","","Danielle Joseph, Olivier Ganthier","Author, Illustrator","Female, White (Danielle Joseph), Black/African, Latinx, Male (Olivier Ganthier)","","","Haitian","",""
"15245","Peter Easter Frog","9781481464895","2021","Dealey","Picture Book","Animal Fantasy","No","No","Caitlyn Dlouhy Books / Simon & Schuster","","No","","Christian","","","","Easter book","Animal, Male, Text","","","","Frog","","","","","","","","","","","","","","","","","","","","","","","","","","","","","","","","","","","","Animal","","","","Various species","","","","","","","","","","","","","","","","","","","","","","","","","","","","","","","","","","","","G. Brian Karas, Erin Dealey","Author, Illustrator","Male, White (G. Brian Karas), Female, White (Erin Dealey)","","","","",""
"15430","The Easter Egg Is Missing!","9780358192657","2021","Platt","Picture Book","Board Book, Contemporary","No","No","Houghton Mifflin Harcourt","","No","","Christian, Multicultural General","","Multicultural group (primary)","","Easter book","Christian, Female, Group, Human, Illustrations, Illustrations, Male","","Diverse","","","","","","","","","","","","","","","","","","","","","","","","","","","","","","","","","","","","","","None","","","","","","","","","","","","","","","","","","","","","","","","","","","","","","","","","","","","","","","","Cynthia Platt, Kathryn Selbert","Author, Illustrator","Female, White (Cynthia Platt), Female, White (Kathryn Selbert)","","","","",""
"15433","Your Mama","9781328631886","2021","Ramos","Picture Book","Contemporary","No","No","Houghton Mifflin Harcourt / Versify","","No","","Christian, Latinx","","Cued Latinx (2 primary))","","They go to church.","Female, Human, Illustrations, Illustrations, Latinx, Text, Text","","Brown skin and black hair, Spanish words mixed in text","","2","","","","","","","","","","","","","","","","","","","","","","","","","","","","","","","","","","","","None","","","","","","","","","","","","","","","","","","","","","","","","","","","","","","","","","","","","","","","","NoNieqa Ramos, Jacqueline Alcantara","Author, Illustrator","Female, Latinx (NoNieqa Ramos), Female, Latinx (Jacqueline Alcantara)","","","Honduran American","",""
"15635","Mahalia Jackson: Freedom's Voice (VIP: Very Important People)","9780062978097","2021","SNF Jackson","Non-Fiction","Biography/History, Series Non-fiction","No","No","Harper / HarperCollins","","No","","Black/African, Christian","","African American (primary)","","Christian (primary)","Black/African, Christian, Female, Human, Text, Text","","African American","","","","","","","","","","","","","","","","","","","","","","","","","","","","","","","","","","","","","","None","","","","","","","","","","","","","","","","","","","","","","","","","","","","","","","","","","","","","","","","Denise Lewis Patrick, Jen Bricking","Author, Illustrator","Black/African, Female (Denise Lewis Patrick), Female, White (Jen Bricking)","","","African American","",""
"15646","Too Small Tola","9781536211276","2021","Atinuke","Fiction","Contemporary","No","No","Candlewick","","No","","Black/African, Christian","","Nigerian (primary); set in Nigeria","","Christian (primary); Muslim (secondary)","Black/African, Christian, Female, Human, Text, Text","","Nigerian","","","","","","","","","","","","","","","","","","","","","","","","","","","","","","","","","","","","","","Black/African, Christian, Female, Human, Illustrations, Male, Muslim, Text, Text","","Tola's family members are Nigerian. Mr. Abdul's heritage is unspecified. ","","","Tola's family is Christian. Mr. Abdul and his family are Muslim.","","","","","","","","","","","","","","","","","","","","","","","","","","","","","","","","","","","Atinuke, Onyinye Iwu","Author, Illustrator","Black/African, Female ( Atinuke), Black/African, Female (Onyinye Iwu)","","","Nigerian, Nigerian (born in Italy, now lives in UK)","",""
"15659","Forward Me Back to You","9780374304928","2019","Perkins","Fiction","Contemporary","No","No","Farrar Straus Giroux","","No","","Asian, Christian, Latinx","","Biracial (Brazilian American/white) (1 primary); Indian American (1 primary); set in India","","Christian (primary)","Asian, Christian, Female, Human, Latinx, Male, Multiracial, Other Heritage Specification, Text","","Katina is biracial (Brazilian American/white). Ravi is Indian American.","","2","","Kirkus","","","","","","","","","","","","","","","","","","","","","","","","","","","","","","","","","","None","","","","","","","","","","","","","","","","","","","","","","","","","","","","","","","","","","","","","","","","Mitali Perkins","Author","Asian, Female (Mitali Perkins)","","","Indian (Bengali) American","",""
"15681","I Was Their American Dream","9780525575115","2019","741.5 Gharib","Non-Fiction","Biography/History, Graphic Novel","No","No","Clarkson Potter / Crown","","No","","Arab, Asian, Black/African, Christian, Muslim","","Biracial (Filipinx/Egyptian American) (primary)","","Primary character's mother is Catholic, her father Muslim.","Arab, Asian, Black/African, Christian, Female, Human, Multiracial, Muslim, Text, Text","","Malaka is biracial (Egyptian and Filipinx American).","","","Her family is interfaith (Catholic and Muslim).","","","","","","","","","","","","","","","","","","","","","","","","","","","","","","","","","","","None","","","","","","","","","","","","","","","","","","","","","","","","","","","","","","","","","","","","","","","","Malaka Gharib","Author","Arab, Asian, Black/African, Female (Malaka Gharib)","","","Biracial (Filipinx/Egyptian American)","",""
"15803","Joe Biden: Our 46th President","9781534479326","2021","920 Biden","Non-Fiction","Biography/History","No","No","Aladdin / Simon & Schuster","","No","","Christian, Cognitive/Neurological","Stutter (primary)","","","Catholic (primary)","Christian, Cognitive/Neurological, Confirmed White, Human, Male, Text, Text","Stutter","","","","Catholic","","","","","","","","","","","","","","","","","","","","","","","","","","","","","","","","","","","None","","","","","","","","","","","","","","","","","","","","","","","","","","","","","","","","","","","","","","","","Beatrice Gormley","Author","Female, White (Beatrice Gormley)","","","","",""
"16148","All Our Hidden Gifts","9781536213942","2021","O'Donoghue","Fiction","Fantasy","No","No","Candlewick / Walker","","No","","Asian, Christian, LGBTQ Character/Topic","","Biracial (Filipinx Irish/white) (secondary)","Bisexual genderqueer person (secondary)","Primary character attends a Catholic school","Assumed White, Christian, Female, Human, Other Heritage Specification, Text","","","","","Attends a Catholic chool","Kirkus","","","","","","","","","","","","","","","","","","","","","","","","","","","","","","","","","","Asian, Confirmed White, Female, Human, LGBTQ+, Multiracial, Other Gender, Other Heritage Specification, Transgender","","Roe and Lily are assumed white. Fiona is biracial (Filipinx Irish/white).","Roe is bisexual and genderqueer.","","","Kirkus","Roe is genderqueer. Lily and Fiona are cis females.","","","","","","","","","","","","","","","","","","","","","","","","","","","","","","","","","Caroline O'Donoghue","Author","Female, White (Caroline O'Donoghue)","","","","",""
"16189","Friendship Superhero (Courtney, 1986)","9781683371700","2021","Hertz","Fiction","Historical, Series Fiction","No","No","American Girl","","No","","Christian, Physical","HIV/AIDS (secondary)","","","Primary character celebrates Christmas.","Assumed White, Christian, Female, Human, Illustrations, Text, Text","","","","","Courtney and her family celebrate Christmas.","","","","","","","","","","","","","","","","","","","","","","","","","","","","","","","","","","","Asian, Assumed White, Female, Human, Illustrations, Male, Physical, Text, Text","Isaac has HIV/AIDS.","Kip is Japanese American. Isaac and Sarah are white.","","","","","","","","","","","","","","","","","","","","","","","","","","","","","","","","","","","","","","Kellen Hertz","Author","Female, White (Kellen Hertz)","","","","",""
"16298","Anita and the Dragons","9781911373636","2021","Carmona","Picture Book","Contemporary","No","Yes","Lantana","","No","","Black/African, Christian, Latinx","","Afro-Dominican (primary and secondary); set in the Dominican Republic","","Primary character's mother carries rosary beads.","Black/African, Female, Human, Illustrations, Latinx, Text, Text","","Afro-Dominican","","","","","","","","","","","","","","","","","","","","","","","","","","","","","","","","","","","","","","Black/African, Christian, Female, Human, Illustrations, Latinx, Male, Text, Text","","Afro-Dominican","","","Primary character's mother carries rosary beads.","","","","","","","","","","","","","","","","","","","","","","","","","","","","","","","","","","","Hannah Carmona, Anna Cunha","Author, Illustrator","Female, Latinx (Hannah Carmona), Female, Latinx (Anna Cunha)","","","Brazilian, Puerto Rican and Dominican","",""
"16336","Ways to Grow Love (Ryan Hart, #2)","9781547800588","2021","Watson","Fiction","Contemporary, Series Fiction","No","No","Bloomsbury","","No","","Black/African, Christian","","African American (primary and secondary)","","Christian (primary and secondary)","Black/African, Christian, Female, Human, Text, Text","","African American","","","","","","","","","","","","","","","","","","","","","","","","","","","","","","","","","","","","","","Black/African, Christian, Female, Human, Male, Text, Text","","African American","","","","","","","","","","","","","","","","","","","","","","","","","","","","","","","","","","","","","","Renee Watson, Nina Mata","Author, Illustrator","Black/African, Female (Renee Watson), Asian, Female (Nina Mata)","","","African American, Filipino American","",""
"16345","These Unlucky Stars","9781547605385","2021","McDunn","Fiction","Contemporary","No","No","Bloomsbury","","No","","Christian","","","","Christian (primary)","Assumed White, Christian, Female, Human, Other Heritage Specification, Text","","","","","","Kirkus","","","","","","","","","","","","","","","","","","","","","","","","","","","","","","","","","","Assumed White, Female, Human, Other Heritage Specification, Text","","","","","","Kirkus","","","","","","","","","","","","","","","","","","","","","","","","","","","","","","","","","","Gillian McDunn","Author","Female, White (Gillian McDunn)","","","","",""
"16380","Baby Loves Electrical Engineering on Christmas!","9781623541910","2021","SNF","Non-Fiction","Board Book, Series Non-fiction","No","No","Charlesbridge","","No","","Brown Skin Unspecified, Christian","","Brown skin (primary)","","Christmas book","Brown Skin, Christian, Female, Human, Illustrations, Illustrations","","","","","Celebrates Christmas","","","","","","","","","","","","","","","","","","","","","","","","","","","","","","","","","","","None","","","","","","","","","","","","","","","","","","","","","","","","","","","","","","","","","","","","","","","","Ruth Spiro, Irene Chan","Author, Illustrator","Female, White (Ruth Spiro), Asian, Female (Irene Chan)","","","Hong Konger","",""
"16396","Sonia Sotomayor (She Persisted)","9780593116029","2021","SNF","Non-Fiction","Biography/History, Series Non-fiction","No","No","Penguin Random House / Philomel","","No","","Christian, Latinx, Physical","Type 1 diabetes (primary)","Puerto Rican American (primary)","","Catholic (primary)","Christian, Female, Human, Latinx, Physical, Text, Text","Type 1 diabetes","Puerto Rican American","","","Catholic","","","","","","","","","","","","","","","","","","","","","","","","","","","","","","","","","","","None","","","","","","","","","","","","","","","","","","","","","","","","","","","","","","","","","","","","","","","","Meg Medina, Gillian Flint","Author, Illustrator","Female, Latinx (Meg Medina), Female, White (Gillian Flint)","","","","",""
