"8590","The Golden Rule","9781419740695","2019","Cooper","Picture Book","Contemporary","Yes","No","Abrams","2007","No","","Christian, Jewish, Muslim, Other Religion","","","","About the Golden Rule in various religious traditions: Christianity, Judaism, Islam, Hinduism, Buddhism, and Shawnee tradition.","Assumed White, Human, Illustrations, Male, Text","","","","","","","","","","","","","","","","","","","","","","","","","","","","","","","","","","","","","","","","Assumed White, Human, Illustrations, Male, Text","","","","","","","","","","","","","","","","","","","","","","","","","","","","","","","","","","","","","","","","Ilene Cooper, Gabi Swiatkowska","Author, Illustrator","Female, White (Ilene Cooper), Female, White (Gabi Swiatkowska)","","","","",""
"8667","The Legend of the Fairy Stones","9781642791969","2019","White","Picture Book","","No","No","Morgan James","","No","","Christian","","","","A Christian legend","Female, Illustrations, Male, Other Type","","","","Fairies","","","","","","","","","","","","","","","","","","","","","","","","","","","","","","","","","","","","None","","","","","","","","","","","","","","","","","","","","","","","","","","","","","","","","","","","","","","","","Kelly Anne White","Author","Female, White (Kelly Anne White)","","","","",""
"8735","Martin & Anne: The Kindred Spirits of Dr. Martin Luther King, Jr. and Anne Frank","9781939547538","2019","323 Churnin","Non-Fiction","Biography/History","No","No","Creston","","No","","Black/African, Christian, Jewish","","African American (1 of 2 primary)","","Christian (1 of 2 primary); Jewish (1 of 2 primary)","Black/African, Christian, Confirmed White, Female, Human, Jewish, Male, Text, Text","","Dr. King was African American. Anne Frank was white.","","Two","Dr. King was Christian. Anne Frank was Jewish.","","","","","","","","","","","","","","","","","","","","","","","","","","","","","","","","","","","None","","","","","","","","","","","","","","","","","","","","","","","","","","","","","","","","","","","","","","","","Nancy Churnin, Yevgenia Nayberg","Author, Illustrator","Female, White (Nancy Churnin), Female, White (Yevgenia Nayberg)","","","","",""
"8754","The Magic Christmas Ornament","9780999869208","2019","Barbato","Picture Book","Contemporary","No","No","Pure Imagination","","No","","Christian","","","","","Assumed White, Christian, Female, Group, Human, Illustrations, Male, Text","","","","Three","","","","","","","","","","","","","","","","","","","","","","","","","","","","","","","","","","","","None","","","","","","","","","","","","","","","","","","","","","","","","","","","","","","","","","","","","","","","","James Barbato, Joe Huffman, Victoria Barbato","Author, Illustrator","Male, White (James Barbato), Male, White (Joe Huffman), Female, White (Victoria Barbato)","","","","",""
"8783","Awesome Possum Powers: Altruism","9781643492728","2019","Beers","Picture Book","Animal Fantasy","No","No","Christian Faith","","No","","Christian","","","","There is a cross on the opossum's dresser.","Animal, Christian, Male, Text","","","","Opossum","There is a cross on his dresser.","","","","","","","","","","","","","","","","","","","","","","","","","","","","","","","","","","","Animal, Female, Male, Text","","","","Opossum; armadillo","","","","","","","","","","","","","","","","","","","","","","","","","","","","","","","","","","","","Shannon Beers, Schuyler Beers","Author, Illustrator","Female, Heritage Unknown (Shannon Beers), Heritage Unknown, Unknown (Schuyler Beers)","","","","",""
"9094","Normal","9781328631831","2020","Newman","Fiction","","No","No","Houghton Mifflin Harcourt","","No","","Christian, Jewish, Physical","Treacher Collins syndrome (primary)","","","Jewish (1 primary); Catholic (1 primary)","Assumed White, Christian, Female, Human, Jewish, Male, Physical, Text, Text","Nathaniel has Treacher Collins syndrome.","","","Two","Magda is Catholic. Nathaniel is Jewish.","","","","","","","","","","","","","","","","","","","","","","","","","","","","","","","","","","","None","","","","","","","","","","","","","","","","","","","","","","","","","","","","","","","","","","","","","","","","Neil Swaab, Magdalena Newman, Nathaniel Newman, Hilary Liftin","Author, Illustrator","Male, White (Neil Swaab), Female, White (Magdalena Newman), Male, Physical, White (Nathaniel Newman), Female, White (Hilary Liftin)","Treacher Collins Syndrome","","","",""
"9095","How to Build a Heart","9781616208493","2020","Padian","Fiction","Contemporary","No","No","Algonquin","","No","","Christian, Latinx","","Puerto Rican American (primary)","","Catholic (primary)","Christian, Female, Human, Latinx, Text, Text","","Puerto Rican American","","","Catholic","","","","","","","","","","","","","","","","","","","","","","","","","","","","","","","","","","","Female, Human, Latinx, Male, Other Heritage Specification","","Izzy's mother--Puerto Rican American. Aubrey and Sam--unknown.","","","","Kirkus","","","","","","","","","","","","","","","","","","","","","","","","","","","","","","","","","","Maria Padian","Author","Female, White (Maria Padian)","","","","",""
"9096","Not So Pure and Simple","9780062349194","2020","Giles","Fiction","Contemporary","No","No","HarperCollins / HarperTeen","","No","","Black/African, Christian","","African American (primary and secondary)","","Most characters are Christian. Much of the story revolves around a church program.","Black/African, Christian, Human, Male, Text, Text","","African American","","","","","","","","","","","","","","","","","","","","","","","","","","","","","","","","","","","","","","Black/African, Christian, Female, Human, LGBTQ+, Male, Text, Text","","African American","One character is gay.","","","","","","","","","","","","","","","","","","","","","","","","","","","","","","","","","","","","","Lamar Giles","Author","Black/African, Male (Lamar Giles)","","","African American","",""
"9201","Santa Is Coming to Wisconsin","9781728201146","2019","Smallman","Picture Book","Fantasy","No","No","Sourcebooks / Sourcebooks Jabberwocky","","No","","Christian","","","","Christmas book","Assumed White, Human, Illustrations, Male, Text","","","","Santa Claus","","","","","","","","","","","","","","","","","","","","","","","","","","","","","","","","","","","","None","","","","","","","","","","","","","","","","","","","","","","","","","","","","","","","","","","","","","","","","Steve Smallman, Robert Dunn, Katherine Kirkland","Author, Illustrator","Male, White (Steve Smallman), Male, White (Robert Dunn), Female, White (Katherine Kirkland)","","","","",""
"9231","Santa Claus Vs. the Easter Bunny","9781492691648","2019","Blunt","Picture Book","Fantasy","No","No","Sourcebooks / Sourcebooks Jabberwocky","","No","","Christian","","","","About two Christian holidays","Assumed White, Human, Illustrations, Male, Other Type, Text","","","","Easter Bunny; Santa Claus","","","","","","","","","","","","","","","","","","","","","","","","","","","","","","","","","","","","None","","","","","","","","","","","","","","","","","","","","","","","","","","","","","","","","","","","","","","","","Fred Blunt, Fred Blunt","Author, Illustrator","Male, White (Fred Blunt), Male, White (Fred Blunt)","","","","",""
"9232","Dear Santa","9781492694748","2019","Hill","Picture Book","Fantasy","No","No","Sourcebooks / Sourcebooks Wonderland","","No","","Black/African, Christian","","Biracial (African American/white) (primary)","","Christmas book","Assumed White, Black/African, Christian, Human, Illustrations, Male, Multiracial, Text","","Parker appears to be African American. He may be biracial: his mother is Black, and his father is white.","","","Parker and his family celebrate Christmas.","","","","","","","","","","","","","","","","","","","","","","","","","","","","","","","","","","","None","","","","","","","","","","","","","","","","","","","","","","","","","","","","","","","","","","","","","","","","Susanna Leonard Hill, John Joseph","Author, Illustrator","Female, White (Susanna Leonard Hill), Male, White (John Joseph)","","","","",""
"9260","We Are Lost and Found","9781492681045","2019","Dunbar","Fiction","Historical","No","No","Sourcebooks Fire","","No","","Christian, LGBTQ Character/Topic","","","Gay (primary and secondary); set in the wake of the AIDS crisis","The primary character is raised in a Catholic family.","Assumed White, Human, LGBTQ+, Male, Other Heritage Specification, Text","","","Gay","","","Kirkus","","","","","","","","","","","","","","","","","","","","","","","","","","","","","","","","","","Assumed White, Female, Human, LGBTQ+, Male, Other Heritage Specification, Text","","Connor is assumed white. James, Becky, and Gabriel are unknown.","Connor and Gabriel are gay.","Four: James, Becky, Connor, Gabriel","","Kirkus","","","","","","","","","","","","","","","","","","","","","","","","","","","","","","","","","","Helene Dunbar","Author","Female, White (Helene Dunbar)","","","","",""
"9265","The Easter Bunny Is Coming to Wisconsin","9781728201894","2019","Easter","Picture Book","Fantasy","No","No","Sourcebooks Wonderland","","No","","Christian, Multicultural General","","Multicultural (secondary)","","Easter book","Animal, Female, Text","","","","Easter Bunny","","","","","","","","","","","","","","","","","","","","","","","","","","","","","","","","","","","","Female, Group, Human, Illustrations, Male, Text","","Diverse","","","","","","","","","","","","","","","","","","","","","","","","","","","","","","","","","","","","","","Eric James, Mari Lobo","Author, Illustrator","Heritage Unknown, Male (Eric James), Female, Latinx (Mari Lobo)","","","Brazilian","",""
"9266","Don't Shake the Present","9781492691679","2019","Cotter","Picture Book","Board Book, Fantasy","No","No","Sourcebooks Jabberwocky","","No","","Christian","","","","Christmas book","Male, Other Type, Text","","","","Monster","","","","","","","","","","","","","","","","","","","","","","","","","","","","","","","","","","","","Assumed White, Illustrations, Male, Other Type, Text","","","","Santa Claus","","","","","","","","","","","","","","","","","","","","","","","","","","","","","","","","","","","","Bill Cotter, Bill Cotter","Author, Illustrator","Male, White (Bill Cotter), Male, White (Bill Cotter)","","","","",""
"9336","Cookies for Santa","9781492677710","2019","Cookies","Picture Book","Fantasy","No","No","Sourcebooks eXplore","","No","","Asian, Christian","","Biracial (Asian/white) primary","","Christmas book","Asian, Assumed White, Christian, Female, Human, Illustrations, Male, Multiracial, Text","","Santa is white. Abigail and William are biracial (Asian/white).","","Three: Santa, Abigail, William","Abigail and William celebrate Christmas.","","","","","","","","","","","","","","","","","","","","","","","","","","","","","","","","","","","None","","","","","","","","","","","","","","","","","","","","","","","","","","","","","","","","","","","","","","","","Johanna Tarkela","Illustrator","Female, White (Johanna Tarkela)","","","Finnish","",""
"9409","Finding Home (Baxter Family Children)","9781534412187","2020","Kingsbury","Fiction","Contemporary, Series Fiction","No","No","Paula Wiseman Books / Simon & Schuster","","No","","Christian","","","","Christian (primary family)","Christian, Confirmed White, Female, Group, Human, Male, Other Heritage Specification, Text","","","","Five siblings","","Kirkus review of previous book in series","","","","","","","","","","","","","","","","","","","","","","","","","","","","","","","","","","None","","","","","","","","","","","","","","","","","","","","","","","","","","","","","","","","","","","","","","","","Karen Kingsbury, Tyler Russell","Author","Female, White (Karen Kingsbury), Male, White (Tyler Russell)","","","","",""
"9414","Flowers in the Gutter: The True Story of the Edelweiss Pirates, Teenagers Who Resisted the Nazis","9780525555414","2020","943 Gaddy","Non-Fiction","Biography/History","No","No","Dutton / Penguin Random House","","No","","Christian","","","","Most of the Edelweiss Pirates were Christian.","Assumed White, Christian, Female, Group, Human, Male, Text, Text","","","","","","","","","","","","","","","","","","","","","","","","","","","","","","","","","","","","","","","","None","","","","","","","","","","","","","","","","","","","","","","","","","","","","","","","","","","","","","","","","K. R. Gaddy","Author","Female, White (K. R. Gaddy)","","","","",""
"9460","I Love You to the Moon and Back","9781492679325","2020","Love","Picture Book","Contemporary","No","No","Sourcebooks Wonderland","","No","","Christian, Multicultural General","","Multicultural (primary)","","The book references God/He/Him throughout.","Female, Group, Human, Illustrations, Illustrations, Male","","Diverse","","Different kids shown on each page","","","","","","","","","","","","","","","","","","","","","","","","","","","","","","","","","","","","None","","","","","","","","","","","","","","","","","","","","","","","","","","","","","","","","","","","","","","","","Susanna Leonard Hill, Kim Lawrence","Author, Illustrator","Female, White (Susanna Leonard Hill), Female, Heritage Unknown (Kim Lawrence)","","","","",""
"9490","Brown Baby Lullaby","9780374307523","2020","Brown","Picture Book","Contemporary","No","No","Farrar Straus Giroux / Macmillan","","No","","Black/African, Christian, Latinx","","Afro-Latinx (primary characters)","","The family prays with folded hands before dinner","Black/African, Christian, Female, Group, Human, Illustrations, Latinx, Male, Text, Text","","Appear to be Afro-Latinx. They use some Spanish in the narrative.","","Family of 3","The family prays at dinnertime, with hands together as Christians pray.","","Mother and father with a baby boy.","","","","","","","","","","","","","","","","","","","","","","","","","","","","","","","","","None","","","","","","","","","","","","","","","","","","","","","","","","","","","","","","","","","","","","","","","","AG Ford, Tameka Fryer Brown","Author, Illustrator","Black/African, Male (AG Ford), Black/African, Female (Tameka Fryer Brown)","","","African American","",""
"9512","Prairie Lotus","9781328781505","2020","Park","Fiction","Historical","No","No","Clarion / Houghton Mifflin Harcourt","","No","","Asian, Christian","","Multiracial (white/Chinese/Korean) (primary)","","Christian (primary)","Asian, Christian, Confirmed White, Female, Human, Multiracial, Text, Text","","Hanna is of white/Chinese/Korean heritage.","","","","","","","","","","","","","","","","","","","","","","","","","","","","","","","","","","","","","","Confirmed White, Female, Human, Indigenous, Male, Text, Text","","Hanna's father, teacher, and schoolmates are white. Her mother was Korean and Chinese. Wichapiwin is a member of the Ihanktonwan tribe, of the Oceti Sakowin Nation.","","","","","","","","","","","","","","","","","","","","","","","","","","","","","","","","","","","","","","Linda Sue Park","Author","Asian, Female (Linda Sue Park)","","","Korean American","",""
"9538","God Is Great, God Is Good","9781419740947","2020","223 Baker","Non-Fiction","Board Book","Yes","No","Abrams / Abrams Appleseed","1987","No","","Christian, Jewish","","","","Based on the book of Job in the Hebrew Bible","Christian, Jewish, Male, Other Type, Text","","","","God","This book is based on the book of Job from the Hebrew Bible.","","The text refers to God as ""he.""","","","","","","","","","","","","","","","","","","","","","","","","","","","","","","","","","None","","","","","","","","","","","","","","","","","","","","","","","","","","","","","","","","","","","","","","","","Tomie dePaola, Sanna Anderson Baker","Author, Illustrator","Male, White (Tomie dePaola), Female, Heritage Unknown (Sanna Anderson Baker)","","","","",""
"9547","By and By: Charles Albert Tindley the Father of Gospel Music","9781534426368","2020","287 Weatherford","Non-Fiction","Biography/History","No","No","Atheneum / Simon & Schuster","","No","","Black/African, Christian","","African American (primary)","","Christian (primary)","Black/African, Christian, Human, Male, Text, Text","","African American","","","","","","","","","","","","","","","","","","","","","","","","","","","","","","","","","","","","","","None","","","","","","","","","","","","","","","","","","","","","","","","","","","","","","","","","","","","","","","","Bryan Collier, Carole Boston Weatherford","Author, Illustrator","Black/African, Male (Bryan Collier), Black/African, Female (Carole Boston Weatherford)","","","African American","",""
"9548","Fred's Big Feelings: The Life and Legacy of Mister Rogers","9781534441224","2020","791 Renauld","Non-Fiction","Biography/History","No","No","Atheneum / Simon & Schuster","","No","","Christian","","","","Christian (primary)","Christian, Confirmed White, Human, Male, Text, Text","","","","","","","","","","","","","","","","","","","","","","","","","","","","","","","","","","","","","","","","None","","","","","","","","","","","","","","","","","","","","","","","","","","","","","","","","","","","","","","","","Brigette Barrager, Laura Renauld","Author, Illustrator","Female, White (Brigette Barrager), Female, White (Laura Renauld)","","","","",""
"9562","On Wings of Words: The Extraordinary Life of Emily Dickinson","9781452142975","2020","811 Berne","Non-Fiction","Biography/History","No","No","Chronicle","","No","","Christian","","","","Christian (primary)","Christian, Confirmed White, Female, Human, Other Heritage Specification, Text","","","","","Emily had a Christian upbringing.","Real person","","","","","","","","","","","","","","","","","","","","","","","","","","","","","","","","","","None","","","","","","","","","","","","","","","","","","","","","","","","","","","","","","","","","","","","","","","","Becca Stadtlander, Jennifer Berne","Author, Illustrator","Female, White (Becca Stadtlander), Female, White (Jennifer Berne)","","","","",""
"9600","Efren Divided","9780062881687","2020","Cisneros","Fiction","Contemporary","No","No","Harper / HarperCollins","","No","","Christian, Cognitive/Neurological, Latinx","Learning difficulties due to lack of oxygen at birth (secondary)","Mexican American (primary and secondary)","","Catholic (primary and secondary)","Christian, Human, Latinx, Male, Text, Text","","Mexican American","","","Catholic","","","","","","","","","","","","","","","","","","","","","","","","","","","","","","","","","","","Christian, Cognitive/Neurological, Female, Group, Human, Latinx, Male, Text, Text","Efren's little brother has learning difficulties due to lack of oxygen at birth.","Mexican American","","Four family members","Catholic","","","","","","","","","","","","","","","","","","","","","","","","","","","","","","","","","","","Ernesto Cisneros","Author","Latinx, Male (Ernesto Cisneros)","","","","",""
"9675","The Oldest Student: How Mary Walker Learned to Read","9781524768287","2020","306 Hubbard","Non-Fiction","Biography/History","No","No","Random House / Schwartz & Wade","","No","","Black/African, Christian","","African American (primary)","","Christian (primary)","Black/African, Christian, Female, Human, Text, Text","","African American","","","","","","","","","","","","","","","","","","","","","","","","","","","","","","","","","","","","","","None","","","","","","","","","","","","","","","","","","","","","","","","","","","","","","","","","","","","","","","","Oge Mora, Rita Lorraine Hubbard","Author, Illustrator","Black/African, Female (Oge Mora), Black/African, Female (Rita Lorraine Hubbard)","","","African American, Nigerian American","",""
"9706","Show Me a Sign","9781338255812","2020","LeZotte","Fiction","Historical","No","No","Scholastic Press","","No","","Christian, Physical","Deaf (primary and many secondary characters)","","","Christian (primary and many secondary)","Christian, Confirmed White, Female, Human, Physical, Text, Text","Mary is Deaf.","","","","","","","","","","","","","","","","","","","","","","","","","","","","","","","","","","","","","","","Black/African, Christian, Confirmed White, Female, Human, Indigenous, Male, Multiracial, Psychiatric, Text, Text","Several secondary characters are Deaf.","Some are white. Thomas is African American. His daughter is African American/Wampanoag. ","","","","","","","","","","","","","","","","","","","","","","","","","","","","","","","","","","","","","","Ann Clare LeZotte","Author","Female, LGBTQ, Physical, White (Ann Clare LeZotte)","Deaf","Lesbian","","",""
"9719","The Tooth Fairy vs. the Easter Bunny","9780593094051","2020","Deenihan","Picture Book","Fantasy","No","No","Penguin Random House / Penguin Workshop","","No","","Christian","","","","This is an Easter book.","Assumed White, Illustrations, Male, Other Type, Text","","","","Tooth Fairy","","","","","","","","","","","","","","","","","","","","","","","","","","","","","","","","","","","","Male, Other Type, Text","","","","Easter Bunny","","","","","","","","","","","","","","","","","","","","","","","","","","","","","","","","","","","","Jamie L. B. Deenihan, Erin Hunting","Author, Illustrator","Female, White (Jamie L. B. Deenihan), Female, White (Erin Hunting)","","","","","Eyelashes"
"9728","The Light in Hidden Places","9781338355932","2020","Cameron","Fiction","Historical","No","No","Scholastic Press","","No","","Christian, Jewish","","","","Catholic (primary); Jewish (secondary)","Christian, Confirmed White, Female, Human, Other Heritage Specification, Text","","Polish","","","Catholic","Kirkus","","","","","","","","","","","","","","","","","","","","","","","","","","","","","","","","","","Assumed White, Confirmed White, Female, Human, Jewish, Male, Other Heritage Specification, Text, Text","","Fusia's sister is Polish. The others are assumed white.","","","","Kirkus","","","","","","","","","","","","","","","","","","","","","","","","","","","","","","","","","","Sharon Cameron","Author","Female, White (Sharon Cameron)","","","","",""
"9782","As It Is in Heaven: A Collection of Prayers for All Ages","9780802855381","2020","242 Puybaret","Non-Fiction","","No","No","Eerdmans","","Yes","Translated from the French. Originally published in France.","Christian","","","","A book of Christian prayers","None","","","","","","","","","","","","","","","","","","","","","","","","","","","","","","","","","","","","","","","","None","","","","","","","","","","","","","","","","","","","","","","","","","","","","","","","","","","","","","","","","Eric Puybaret","Illustrator","Male, White (Eric Puybaret)","","","","",""
"9854","Flash and Gleam: Light in Our World","9781541557703","2020","Fliess","Picture Book","Contemporary","No","No","Lerner / Millbrook","","No","","Christian, Jewish, Multicultural General, Other Religion","","4 primary: Thai, Israeli, African American, Indian","","Jewish (1 of 4 primary); Christian (1 of 4 primary); Hindu (1 of 4 primary)","Asian, Black/African, Christian, Female, Group, Human, Illustrations, Jewish, Male, Middle East, Other Religion, Text","","African American, Thai, Indian, Israeli","","Four","1 Christian, 1 Jewish, 1 Hindu","","","","","","","","","","","","","","","","","","","","","","","","","","","","","","","","","","","None","","","","","","","","","","","","","","","","","","","","","","","","","","","","","","","","","","","","","","","","Sue Fliess, Khoa Le","Author, Illustrator","Female, White (Sue Fliess), Asian, Female (Khoa Le)","","","Vietnamese","",""
"10329","The Water Bears","9781984852205","2020","Baker","Fiction","Contemporary","No","No","Random House / Wendy Lamb Books","","No","","Christian, Latinx, Physical, Psychiatric","Newt (primary) has physical limitations due to a knee injury--he was bitten by a bear. He also seems to have PTSD.","Mexican American (primary)","","The family has several statues of the Virgin of Guadalupe in their home.","Christian, Human, Latinx, Male, Physical, Psychiatric, Text, Text","Newt (primary) has physical limitations due to a knee injury--he was bitten by a bear. He also seems to have PTSD.","Mexican American","","","","","","","","","","","","","","","","","","","","","","","","","","","","","","","","","","","","","","Assumed White, Female, Human, Latinx, Male, Text","","Primary character's siblings and parents are Mexican American. Izzy and Ethan are presumed white.","","","","","","","","","","","","","","","","","","","","","","","","","","","","","","","","","","","","","","Kim Baker","Author","Female, Latinx, Multiracial (Kim Baker)","","","Biracial (Mexican American/white)","",""
"10938","The Stepmom Shake-up","9781984892546","2020","Lenz","Fiction","Contemporary","No","No","Random House","","No","","Christian","","","","Baptist (primary and secondary)","Assumed White, Christian, Female, Human, Other Heritage Specification, Text","","","","","Baptist","Kirkus","","","","","","","","","","","","","","","","","","","","","","","","","","","","","","","","","","Assumed White, Christian, Female, Human, Male, Other Heritage Specification, Text","","Davy, Bea, and Miss O'Connor are assumed white.","","","Davy is a Baptist preacher.","Kirkus","","","","","","","","","","","","","","","","","","","","","","","","","","","","","","","","","","Niki Lenz","Author","Female, White (Niki Lenz)","","","","",""
