"17930","The Pug Who Wanted to Be a Reindeer","9781534486829","2021","Swift","Fiction","Animal Fantasy, Series Fiction","No","No","Aladdin / Simon & Schuster","","No","","Christian","","","","Primary family celebrates Christmas.","Animal, Female, Text","","","","Dog (pug)","","","","","","","","","","","","","","","","","","","","","","","","","","","","","","","","","","","","Assumed White, Christian, Female, Human, Illustrations, Male, Text","","","","","They celebrate Christmas.","","","","","","","","","","","","","","","","","","","","","","","","","","","","","","","","","","","Bella Swift","Author","Female, White (Bella Swift)","","","","",""
"17939","Christmas is Coming: Traditions from Around the World","9780735844438","2021","394 Utnik-Strugala","Non-Fiction","","No","No","NorthSouth","","Yes","Translated from the Polish. Originally published in Poland.","Christian, Multicultural General","","About Christmas traditions around the world","","About Christmas traditions","None","","","","","","","","","","","","","","","","","","","","","","","","","","","","","","","","","","","","","","","","None","","","","","","","","","","","","","","","","","","","","","","","","","","","","","","","","","","","","","","","","Monika Utnik-Strugata, Ewa Poklewska-Koziello, Antonia Lloyd-Jones","Author, Illustrator, Translator","Female, White (Monika Utnik-Strugata), Female, White (Ewa Poklewska-Koziello), Female, White (Antonia Lloyd-Jones)","","","","",""
"17951","Super Santa: The Science of Christmas","9780062983633","2021","Hale","Picture Book","Fantasy","No","No","Harper / HarperCollins","","No","","Christian","","","","Christmas book","Assumed White, Human, Illustrations, Male, Text","","","","Santa Claus","","","","","","","","","","","","","","","","","","","","","","","","","","","","","","","","","","","","Animal, Illustrations, Other Type, Unknown","","The elves have various skin tones.","","Elves and reindeer","","","","","","","","","","","","","","","","","","","","","","","","","","","","","","","","","","","","Bruce Hale, Guy Francis","Author, Illustrator","Male, White (Bruce Hale), Male, White (Guy Francis)","","","","",""
"17952","The Snowflake","9780062563606","2021","Davies","Picture Book","Fantasy","No","No","Harper / HarperCollins","","No","","Christian","","","","Christian (primary)","Assumed White, Christian, Female, Human, Illustrations, Other Type, Text","","","","A girl and a snowflake","The girl celebrates Christmas.","","","","","","","","","","","","","","","","","","","","","","","","","","","","","","","","","","","None","","","","","","","","","","","","","","","","","","","","","","","","","","","","","","","","","","","","","","","","Benji Davies, Benji Davies","Author, Illustrator","Male, White (Benji Davies), Male, White (Benji Davies)","","","","",""
"17987","The First Christmas","9781534478787","2021","782 Brooks","Non-Fiction","","No","No","Paula Wiseman Books / Simon & Schuster","","No","","Christian, Jewish, Middle East","","Set in first-century Palestine; characters are from there","","A book about Christmas (Christian). Jesus, Mary, and Joseph were Jewish.","Female, Human, Jewish, Male, Middle East, Text, Text","","First-century Palestinian","","3","Jesus, Mary, and Joseph were Jewish.","","","","","","","","","","","","","","","","","","","","","","","","","","","","","","","","","","","None","","","","","","","","","","","","","","","","","","","","","","","","","","","","","","","","","","","","","","","","Will Moses, Phillips Brooks","Author, Illustrator","Male, White (Will Moses), Christian, Male, White (Phillips Brooks)","","","","",""
"17995","Just Ash","9781541599246","2021","Santana","Fiction","Contemporary","No","No","Carolrhoda Lab / Lerner","","No","","Black/African, Christian, LGBTQ Character/Topic","","African American (secondary)","Intersex boy (primary)","Secondary character attends a Christian conversion therapy camp.","Assumed White, Human, Male, Other Heritage Specification, Text","","","","","","Kirkus","Ash is an intersex boy.","","","","","","","","","","","","","","","","","","","","","","","","","","","","","","","","","Black/African, Female, Human, Text, Text","","Michelle is African American.","","","","","","","","","","","","","","","","","","","","","","","","","","","","","","","","","","","","","","Sol Santana","Author","LGBTQ, Unknown, White (Sol Santana)","","She is intersex. (She/her pronouns)","","",""
"18012","Robin Hood: The Shadows of Sherwood Forest","9781646900077","2021","Roehrig","Fiction","Historical","No","No","Arctis","","Yes","Translated from the German. Originally published in Germany.","Christian","","","","Kirkus notes the cast is uniformly (except for one Jewish secondary character) Christian.","Christian, Confirmed White, Human, Male, Other Heritage Specification, Text","","","","","","Kirkus","","","","","","","","","","","","","","","","","","","","","","","","","","","","","","","","","","Christian, Confirmed White, Female, Human, Male, Other Heritage Specification, Text","","","","","","Kirkus","","","","","","","","","","","","","","","","","","","","","","","","","","","","","","","","","","Tilman Roehrig, Oliver Latsch","Author, Translator","Male, White (Tilman Roehrig), Male, White (Oliver Latsch)","","","","",""
"18053","Nina: A Story of Nina Simone","9781524737283","2021","920 Simone","Non-Fiction","Biography/History","No","No","Penguin Random House / Putnam","","No","","Black/African, Christian","","African American (primary)","","Christian (primary)","Black/African, Christian, Female, Human, Text, Text","","African American","","","","","","","","","","","","","","","","","","","","","","","","","","","","","","","","","","","","","","None","","","","","","","","","","","","","","","","","","","","","","","","","","","","","","","","","","","","","","","","Traci N. Todd, Christian Robinson","Author, Illustrator","Black/African, Female (Traci N. Todd), Black/African, Male (Christian Robinson)","","","African American","",""
"18084","20 Big Trucks in the Middle of Christmas","9781536212532","2021","Lee","Picture Book","Contemporary","No","No","Candlewick","","No","","Christian","","","","Christmas book","Assumed White, Human, Illustrations, Unknown","","Diverse","","2","","","","","","","","","","","","","","","","","","","","","","","","","","","","","","","","","","","","","","","","","","","","","","","","","","","","","","","","","","","","","","","","","","","","","","","","","","","","Mark Lee, Kurt Cyrus","Author, Illustrator","Heritage Unknown, Male (Mark Lee), Male, White (Kurt Cyrus)","","","","",""
"18140","Sister Corita's Words and Shapes","9781534496019","2021","920 Kent","Non-Fiction","Biography/History","No","No","Beach Lane / Simon & Schuster","","No","","Christian","","","","Catholic (primary)","Assumed White, Christian, Female, Human, Text, Text","","","","","Catholic","","","","","","","","","","","","","","","","","","","","","","","","","","","","","","","","","","","None","","","","","","","","","","","","","","","","","","","","","","","","","","","","","","","","","","","","","","","","Jeanette Winter, Jeanette Winter","Author, Illustrator","Female, White (Jeanette Winter), Female, White (Jeanette Winter)","","","","",""
"18155","How Kids Celebrate Holidays Around the World","9788000061306","2021","394 Harastova","Non-Fiction","","No","Yes","Albatros","","No","","Christian, Jewish, Multicultural General, Muslim, Other Religion","","About various holidays around the world","","Among the characters, 2 are Jewish, 2 are Muslim, 3 are Christian, 2 are Hindu, 1 is Buddhist","Christian, Female, Group, Human, Illustrations, Jewish, Male, Muslim, Other Religion, Text, Text","","Diverse","","Different kids throughout","2 are Jewish, 2 are Muslim, 3 are Christian, 2 are Hindu, 1 is Buddhist","","","","","","","","","","","","","","","","","","","","","","","","","","","","","","","","","","","None","","","","","","","","","","","","","","","","","","","","","","","","","","","","","","","","","","","","","","","","Helena Harastova, Pavla Hanackova, Michaela Bergmannova","Author, Illustrator","Female, White (Helena Harastova), Female, White (Pavla Hanackova), Female, White (Michaela Bergmannova)","","","Czech","",""
"18194","Everything Within and In Between","9780062976901","2021","Barthelmess","Fiction","Contemporary","No","No","HarperCollins / HarperTeen","","No","","Christian, Latinx","","Biracial (Mexican American and white) (primary); Latinx (secondary)","","Catholic (primary and secondary)","Christian, Female, Human, Latinx, Multiracial, Other Heritage Specification, Text","","Biracial (Mexican American and white)","","","Catholic","Kirkus","","","","","","","","","","","","","","","","","","","","","","","","","","","","","","","","","","Christian, Female, Human, Latinx, Other Heritage Specification, Text","","Ri's grandmother is Mexican American. Other secondary characters are Latinx.","","","Ri's grandmother is Catholic but moves to a new (non-Catholic) denomination.","Kirkus","","","","","","","","","","","","","","","","","","","","","","","","","","","","","","","","","","Nikki Barthelmess","Author","Female, Jewish, Latinx, Multiracial (Nikki Barthelmess)","","","Biracial (White/Mexican American)","",""
"18197","When We Make It","9780593324486","2021","Velasquez","Fiction","Contemporary","No","No","Dial / Penguin Random House","","No","","Christian, Latinx","","Puerto Rican American (primary)","","Pentecostal (primary)","Christian, Female, Human, Latinx, Other Heritage Specification, Text","","Puerto Rican American","","","Pentecostal","Kirkus","","","","","","","","","","","","","","","","","","","","","","","","","","","","","","","","","","None","","","","","","","","","","","","","","","","","","","","","","","","","","","","","","","","","","","","","","","","Elisabet Velasquez","Author","Female, Latinx (Elisabet Velasquez)","","","Boricua/Puerto Rican","",""
"18246","Santa in the City","9780593110256","2021","Jackson","Picture Book","Contemporary","No","No","Dial / Penguin Random House","","No","","Black/African, Christian, Latinx","","Jamaican American (primary and secondary)","","They celebrate Christmas.","Black/African, Christian, Female, Human, Latinx, Text, Text","","Jamaican American","","","She celebrates Christmas.","","","","","","","","","","","","","","","","","","","","","","","","","","","","","","","","","","","Black/African, Christian, Female, Human, Latinx, Text, Text","","Jamaican American","","","She celebrates Christmas.","","","Black/African, Illustrations, Male, Other Type, Text","","","","Santa Claus","","","","","","","","","","","","","","","","","","","","","","","","","","","","Reggie Brown, Tiffany D. Jackson","Author, Illustrator","Black/African, Male (Reggie Brown), Black/African, Female (Tiffany D. Jackson)","","","African American","",""
"18254","Things We Couldn't Say","9781338734188","2021","Coles","Fiction","Contemporary","No","No","Scholastic / Scholastic Press","","No","","Black/African, Christian, LGBTQ Character/Topic","","African American (primary 1, secondary 2 and 3)","Bisexual cis boy (primary 1); queer cis boy (secondary 1)","Christian (primary 1 and secondary 2)","Black/African, Christian, Human, LGBTQ+, Male, Text, Text","","Gio is African American.","Gio is a bisexual cis boy.","","Gio was raised Christian; his father is a pastor.","","","","","","","","","","","","","","","","","","","","","","","","","","","","","","","","","","","Confirmed White, Human, LGBTQ+, Male, Other Heritage Specification, Text","","","David is a queer cis boy.","","","Kirkus","","Black/African, Christian, Human, Male, Other Heritage Specification, Text","","Gio's dad is African American.","","","Gio's dad is a pastor.","Kirkus","","Black/African, Female, Human, Text","","Gio's mom is assumed African American.","","","","","","","","","","","","","","","","","","","","","","Jay Coles","Author","Black/African, Male (Jay Coles)","","","African American","",""
"18267","Carla and the Christmas Cornbread","9781534494695","2021","Hall","Picture Book","Contemporary","No","No","A Denene Millner Book / Simon & Schuster","","No","","Black/African, Christian","","African American (all characters)","","The family is celebrating Christmas.","Black/African, Christian, Female, Human, Illustrations, Other Heritage Specification, Text","","African American","","","","The character, Carla, is presumably based on Carla Hall, the author, who is African American.","","","","","","","","","","","","","","","","","","","","","","","","","","","","","","","","","","Black/African, Christian, Female, Human, Illustrations, Text","","African American","","","","","","Black/African, Christian, Human, Illustrations, Male, Text","","African American","","","","","","Black/African, Christian, Female, Human, Illustrations, Text","","African American","","","","","","","","","","","","","","","","","","","","","","Carla Hall, Cherise Harris","Author, Illustrator","Black/African, Female (Carla Hall), Female, Latinx (Cherise Harris)","","","African American, Barbados","",""
"18271","'Twas the Night Before Christmas: A Visit from St. Nicholas","9781536222852","2021","Moore","Picture Book","Historical","No","No","Candlewick","","No","","Christian","","","","A Christmas book","Assumed White, Human, Illustrations, Illustrations, Male, Text","","","","","","","","","","","","","","","","","","","","","","","","","","","","","","","","","","","","","","","","Assumed White, Illustrations, Male, Other Type, Text","","","","Santa Claus","","","","","","","","","","","","","","","","","","","","","","","","","","","","","","","","","","","","Clement C. Moore, P. J. Lynch","Author, Illustrator","Male, White (Clement C. Moore), Male, White (P. J. Lynch)","","","","",""
"18299","Birdie's Bargain","9781536215595","2021","Paterson","Fiction","Contemporary","No","No","Candlewick","","No","","Christian","","","","Christian (primary)","Assumed White, Christian, Female, Human, Other Heritage Specification, Text","","","","","","Kirkus","","","","","","","","Kirkus","","","","","","","","","","","","","","","","","","","","","","","","","","Assumed White, Female, Human, Other Heritage Specification, Text","","Alicia is assumed white.","","","","Kirkus","","Assumed White, Human, Male, Other Heritage Specification, Text","","Birdie's dad is assumed white.","","","","Kirkus","","","","","","","","","","","","","","","","","","","","","","","","","","Katherine Paterson","Author","Female, White (Katherine Paterson)","","","","",""
"18330","A Christmas Too Big","9781542028004","2021","Madden","Picture Book","Contemporary","No","No","Two Lions","","No","","Christian, Latinx","","Mexican American (secondary)","","Christmas book","Assumed White, Female, Human, Illustrations, Text","","","","","","","","","","","","","","","","","","","","","","","","","","","","","","","","","","","","","","","","Female, Human, Latinx, Text, Text","","Mrs. Flores is Mexican American.","","","","","","","","","","","","","","","","","","","","","","","","","","","","","","","","","","","","","","Colleen Madden, Colleen Madden","Author, Illustrator","Female, White (Colleen Madden), Female, White (Colleen Madden)","","","","",""
"18331","Portrait of the Son: A Tale of Love","9780940112988","2021","Nobisso","Picture Book","Historical","No","No","Gingerbread House","","No","","Christian","","","","This story is a Christian metaphor.","Assumed White, Human, Illustrations, Male, Text","","","","","","","","Assumed White, Human, Illustrations, Male, Text","","","","","","","","","","","","","","","","","","","","","","","","","","","","","","","","Assumed White, Human, Illustrations, Male, Text","","","","","","","","","","","","","","","","","","","","","","","","","","","","","","","","","","","","","","","","Josephine Nobisso, Ted Schluenderfritz","Author, Illustrator","Female, White (Josephine Nobisso), Male, White (Ted Schluenderfritz)","","","","",""
"18334","The Forgotten Memories of Vera Glass","9781419752599","2021","Priemaza","Fiction","Fantasy","No","No","Abrams / Amulet","","No","","Christian","","","","Christian (primary)","Christian, Confirmed White, Female, Human, Other Heritage Specification, Text","","Vera is white.","","","Vera is Christian.","Kirkus","","","","","","","","","","","","","","","","","","","","","","","","","","","","","","","","","","","","","","","","","","","","","","","","","","","","","","","","","","","","","","","","","","","","","","","","","","Anna Priemaza","Author","Female, White (Anna Priemaza)","","","","",""
"18379","The Toys' Christmas","9780711266391","2021","Clement","Picture Book","Fantasy","No","No","Frances Lincoln Children's Books / Quarto","","Yes","Translated from the French. Originally published in France.","Christian","","","","Christmas book","Male, Not specified, Other Type, Text, Unknown","","","","Toys (stuffed elephant, bear, giraffe, mouse)","","","","","","","","","","","","","","","","","","","","","","","","","","","","","","","","","","","","Assumed White, Human, Illustrations, Male, Text","","","","Santa Claus","","","","","","","","","","","","","","","","","","","","","","","","","","","","","","","","","","","","Claire Clement, Genevieve Godbout","Author, Illustrator","Female, White (Claire Clement), Female, White (Genevieve Godbout)","","","","",""
"18390","The Real Santa","9780593178140","2021","Redd","Picture Book","Contemporary","No","No","Random House","","No","","Black/African, Christian","","African American (all characters)","","Christmas book","Black/African, Christian, Human, Illustrations, Illustrations, Male","","African American","","","He celebrates Christmas.","","","","","","","","","","","","","","","","","","","","","","","","","","","","","","","","","","","","","","","","","","","","","","","","","","","","","","","","","","","","","","","","","","","","","","","","","","","Nancy Redd, Charnelle Pinkney Barlow","Author, Illustrator","Black/African, Female (Nancy Redd), Black/African, Female (Charnelle Pinkney Barlow)","","","African American","",""
"18432","Cole and the Giant Gingerbread House","9781736316931","2021","Aarini","Picture Book","Fantasy","No","No","","","No","","Christian","","","","Christmas book","Assumed White, Human, Illustrations, Male, Text","","","","","","","","","","","","","","","","","","","","","","","","","","","","","","","","","","","","","","","","Assumed White, Female, Human, Illustrations, Text","","","","","","","","Assumed White, Human, Illustrations, Male, Text","","","","Santa Claus","","","","","","","","","","","","","","","","","","","","","","","","","","","","Riya Aarini, Yuliia Valchuk","Author, Illustrator","Asian, Female (Riya Aarini), Female, White (Yuliia Valchuk)","","","Indian American","",""
"18433","Santa's Journey","9780760371954","2021","Albright","Picture Book","Board Book, Fantasy","No","No","becker&mayer! / Quarto","","No","","Christian","","","","Christmas book","Assumed White, Human, Illustrations, Male, Text","","","","Santa Claus","","","","","","","","","","","","","","","","","","","","","","","","","","","","","","","","","","","","","","","","","","","","","","","","","","","","","","","","","","","","","","","","","","","","","","","","","","","","Taryn Albright, Jennie Bradley","Author, Illustrator","Female, White (Taryn Albright), Female, White (Jennie Bradley)","","","","",""
"18435","Grumpy Monkey: Oh, No! Christmas","9780593306093","2021","Lang","Picture Book","Animal Fantasy","No","No","Penguin Random House / Random House Studio","","No","","Christian","","","","Christmas book","Animal, Male, Text","","","","Monkey","","","","","","","","","","","","","","","","","","","","","","","","","","","","","","","","","","","","Animal","","","","Various species","","","","","","","","","","","","","","","","","","","","","","","","","","","","","","","","","","","","Suzanne Lang, Max Lang","Author, Illustrator","Female, White (Suzanne Lang), Male, White (Max Lang)","","","","",""
"18469","Disability Visibility: 17 First-Person Stories for Today","9780593381670","2021","305 Wong","Non-Fiction","Anthology, Biography/History","No","No","Delacorte / Random House","","No","","Christian, Cognitive/Neurological, Jewish, LGBTQ Non-Fiction, Multicultural General, Muslim, Physical, Psychiatric","Each essay concerns disability in some way. There is a wide variety of disabilities represented.","Multicultural (primary)","Several of the essayists are queer and/or nonbinary.","There are Christian, Jewish, and Muslim essayists.","Cognitive/Neurological, Female, Group, Human, LGBTQ+, Male, Other Gender, Physical, Psychiatric, Text, Text, Transgender","A wide variety of disabilities is represented.","Diverse","Several of the essayists are queer and/or nonbinary.","Each essay is written by/about a different person.","","","Men, women, and nonbinary people","","","","","","","","","","","","","","","","","","","","","","","","","","","","","","","","","","","","","","","","","","","","","","","","","","","","","","","","","","","","","","","","","","","","","","","","","Alice Wong","Compiler","Female, White (Alice Wong)","","","","",""
"18472","If You Lived During the Plimoth Thanksgiving","9781338726374","2021","974 Newell","Non-Fiction","Biography/History","No","No","Scholastic / Scholastic Press","","No","","Christian, Indigenous","","Mostly Wampanoag, although other nations are referenced as well.","","The settlers (pilgrims) were Christian separatists.","Christian, Confirmed White, Female, Group, Human, Indigenous, Male, Text, Text","","White settlers and Wampanoag people","","","The white settlers (pilgrims) were Christian separatists.","","","","","","","","","","","","","","","","","","","","","","","","","","","","","","","","","","","","","","","","","","","","","","","","","","","","","","","","","","","","","","","","","","","","","","","","","","","Chris Newell, Winona Nelson","Author, Illustrator","Indigenous, Male (Chris Newell), Female, Indigenous (Winona Nelson)","","","Leech Lake Band of Minnesota Chippewa , Passamaquoddy","",""
"18494","I'm Dreaming of a Wyatt Christmas","9781419754012","2021","Schmidt","Fiction","Contemporary","No","No","Abrams / Amulet","","No","","Christian, Pacific Islander","","Biracial (Native Hawaiian/white) (primary 2)","","Christmas book","Assumed White, Female, Human, Other Heritage Specification, Text","","Noelle is assumed white.","","","","Kirkus","","Human, Male, Multiracial, Other Heritage Specification, Pacific Islander, Text","","Wyatt is biracial (Native Hawaiian and white).","","","","Kirkus","","","","","","","","","","","","","","","","","","","","","","","","","","","","","","","","","","","","","","","","","","","","","","","","","","","","","","","","","","","","","","","","","","Tiffany Schmidt","Author","Female, White (Tiffany Schmidt)","","","","",""
"18542","The Woman All Spies Fear: Code Breaker Elizebeth Smith Friedman and Her Hidden Life","9780593127193","2021","920 Friedman","Non-Fiction","Biography/History","No","No","Random House Studio","","No","","Christian, Jewish","","","","Christian (primary); Jewish (secondary)","Assumed White, Christian, Female, Human, Text, Text","","","","","","","","","","","","","","","","","","","","","","","","","","","","","","","","","","","","","","","","Assumed White, Human, Jewish, Male, Text, Text","","","","","","","","","","","","","","","","","","","","","","","","","","","","","","","","","","","","","","","","Amy Butler Greenfield","Author","Female, White (Amy Butler Greenfield)","","","","",""
"18634","Why Is Everybody Yelling? Growing Up in My Immigrant Family","9780374303839","2021","741.5 Russo","Non-Fiction","Biography/History, Graphic Novel","No","No","Farrar Straus Giroux","","No","","Christian, Jewish, Psychiatric","Unspecified mental illnesses (secondary 2)","","","Primary character and her mother (secondary 1) are Catholic. The mother was Jewish but converted to Catholicism after the Holocaust. Other family members on the mother's side are Jewish.","Christian, Confirmed White, Female, Human, Jewish, Text, Text","","","","","She is Catholic, but she is of Jewish heritage. (Her mother was Jewish before converting to Catholicism as an adult.)","","","","","","","","","","","","","","","","","","","","","","","","","","","","","","","","","","","Christian, Confirmed White, Female, Human, Jewish, Text, Text","","","","","She was born Jewish but converted to Catholicism after the Holocaust.","","","Confirmed White, Human, Jewish, Male, Psychiatric, Text, Text","Various unspecified mental illnesses","","","","","","","Confirmed White, Human, Jewish, Male, Text, Text","","","","","","","","","","","","","","","","","","","","","","","","Marisabina Russo, Marisabina Russo","Author, Illustrator","Female, White (Marisabina Russo), Female, White (Marisabina Russo)","","","","",""
"18648","My Little Prayer","9781952239540","2021","Archuleta","Picture Book","Contemporary","No","No","Bushel & Peck","","No","","Brown Skin Unspecified, Christian","","Brown skin (secondary)","","Christian (primary); the text is a Christian prayer","Assumed White, Christian, Human, Illustrations, Illustrations, Male","","","","","","","","","","","","","","","","","","","","","","","","","","","","","","","","","","","","","","","","Brown Skin, Female, Human, Illustrations, Illustrations","","","","","","","","","","","","","","","","","","","","","","","","","","","","","","","","","","","","","","","","David Archuleta, Sara Ugolotti","Author, Illustrator","Latinx, Male (David Archuleta), Female, White (Sara Ugolotti)","","","Honduran and white (American)","",""
